{"x": {"field": "x", "title": "X (parsecs)", "scale": {"domain": [-48.9578, 48.875], "range": [-1.0, 1.0]}, "type": "quantitative"}, "y": {"field": "y", "title": "Y (parsecs)", "type": "quantitative", "scale": {"domain": [-48.031, 49.461], "range": [0.0, 2.0]}}, "z": {"field": "z", "title": "Z (parsecs)", "scale": {"domain": [-47.595, 48.344], "range": [-1.0, 1.0]}, "type": "quantitative"}, "size": {"value": 0.012}, "color": {"field": "star_class", "title": "Spectral Class", "scale": {"domain": ["O", "B", "A", "F", "G", "K", "M"], "range": ["#1f77b4", "#ff7f0e", "#2ca02c", "#d62728", "#9467bd", "#8c564b", "#e377c2"]}, "type": "nominal", "labels": ["O", "B", "A", "F", "G", "K", "M"]}}