{"x": {"field": "lattitude", "type": "quantitative", "scale": {"domain": [6.133066341452033, 9.630111794568776], "range": [-0.5, 0.5]}, "title": "lattitude"}, "y": {"field": {"group": "fields"}, "title": "Health Costs per Year in CHF", "type": "quantitative", "scale": {"domain": [0, 10], "range": [0.0, 0.5]}}, "z": {"field": "longitude", "type": "quantitative", "scale": {"domain": [46.21056348835942, 47.71400590866982], "range": [-0.31930648069949186, 0.31930648069949186]}, "title": "longitude"}, "color": {"field": {"group": "colors"}}, "size": {"value": 0.015}}