{"x": {"field": "hour", "scale": {"domain": [1, 23], "range": [-0.3, 0.3]}, "title": "hour", "type": "quantitative"}, "y": {"field": "kWh", "scale": {"domain": [0.0, 2.5], "range": [0.0, 0.3]}, "title": "kWh", "type": "quantitative"}, "z": {"field": "day", "title": "day", "scale": {"domain": ["Sun", "Sat", "Fri"], "range": [-0.11363636363636363, -2.523234146875355e-17, 0.11363636363636358]}, "type": "nominal"}, "size": {"value": 0.0475}, "color": {"field": "temp", "title": "Outdoor temperature", "scale": {"domain": [-12, 12], "range": ["#fff5eb", "#feefe0"]}, "type": "quantitative", "labels": [-12, 12]}}