{"x": {"field": "category", "title": "category", "scale": {"domain": ["GDP", "gov debt", "priv debt"], "range": [-0.22727272727272727, -5.04646829375071e-17, 0.22727272727272715]}, "type": "nominal"}, "y": {"field": "value", "scale": {"domain": [0.0, 125000.0], "range": [0.0, 0.55]}, "title": "value", "type": "quantitative"}, "z": {"field": "region", "title": "region", "scale": {"domain": ["US", "EU", "CN"], "range": [-0.17857142857142858, -3.96508223080413e-17, 0.17857142857142852]}, "type": "nominal"}, "color": {"field": "category", "title": "per capita in USD", "type": "nominal", "labels": ["GDP", "gov debt", "priv debt"], "scale": {"domain": ["GDP", "gov debt", "priv debt"], "range": ["#1f77b4", "#ff7f0e", "#2ca02c"]}}}