{"x": {"field": "sepal width", "title": "sepal width", "scale": {"domain": [2.0, 4.4], "range": [-0.4, 0.4]}, "type": "quantitative"}, "y": {"field": "petal length", "title": "petal length", "type": "quantitative", "scale": {"domain": [1.0, 6.9], "range": [0.0, 0.8]}}, "z": {"field": "petal width", "title": "petal width", "scale": {"domain": [0.1, 2.5], "range": [-0.4, 0.4]}, "type": "quantitative"}, "size": {"value": 0.022}, "color": {"field": "class", "title": "Iris Classes", "type": "nominal", "labels": ["Iris-setosa", "Iris-versicolor", "Iris-virginica"], "scale": {"domain": ["Iris-setosa", "Iris-versicolor", "Iris-virginica"], "range": ["#1f77b4", "#ff7f0e", "#2ca02c"]}}}