{"x": {"field": "Work_overload", "title": "Work Overload", "scale": {"domain": [0.0, 100.0], "range": [-1.1, 1.1]}, "type": "quantitative"}, "y": {"field": "Burnout_eff_MEAN", "title": "Burnout", "type": "quantitative", "scale": {"domain": [1.8333333333333333, 7.0], "range": [0.0, 2.2]}}, "z": {"field": "Relation_supervisor_MEAN", "title": "Relation supervisors", "scale": {"domain": [1.0, 7.0], "range": [-1.1, 1.1]}, "type": "quantitative"}, "size": {"value": 0.05}, "color": {"field": "Age", "title": "Age", "type": "quantitative", "labels": [20.0, 61.0], "scale": {"domain": [20.0, 61.0], "range": ["#7f2704", "#7f2704"]}}, "shape": {"field": "Sex", "scale": {"domain": ["Female", "Male"], "range": ["sphere", "box"]}, "title": "Sex", "type": "nominal", "labels": ["Female", "Male"], "marks": ["o", "s"]}}